{"schemaVersion":"1.1.0","locus":"apoa1","interval":{"chromosome":"chr11","start":116837393,"end":116837905},"provenance":{"source":"atlas-api","clientVersion":"0.9.0","pipelineVersion":"0.1.0","queriedAt":"2026-09-12T20:39:11Z","configHash":"63b7cc8d64f3302f","calibrationEpoch":"quantiles>=2026-06-18,indels>=2026-07-14","scorers":["AVI_SCORE","AVI_SCORE_FEATURE_IMPORTANCE","AVI_SCORE_MODEL_FEATURES","RNA_SEQ","ATAC","DNASE","CAGE","PROCAP","CHIP_TF","CHIP_HISTONE","SPLICE_SITE_USAGE","SPLICE_JUNCTIONS","POLYADENYLATION","CONTACT_MAPS"],"hasQuantiles":true},"focus":116837649,"reference":"GGGCCGTGGGGGACCTGGAGGAGAAGAAGGGCCTGGCTGAGTGGGGTGCCTTCAGCATGCAGAAGCCCCGTGCTCCCCCACTCATTGCAGCCAGGTGAGGAGAAGGGCACAGAGCGGGAGAAGACCTCAGGTACCCAGAGGCCCGGCCTGGGGCAAGGCCTGAACCTTGAGCTGGGGAGCCAGAGTGACCGGGGCAGGCAGCAGGACGCACCTCCTTCTCGCAGTCTCTAAGCAGCCAGCTCTTGCAGGGCCTATTTATGTCTGCAGCCAGGGTCTGGGCTGGGAGGCTGATAAGCCCAGCCCCGGCCCTGTTGCTGCTCACTGGTCCTGGCAATGTGGAACTTAAGAGTTCAAGGATCAGCTCTGTCCCTGGGGCTGGGCAAATAGAGTGGGCAAACAGCAAGCTGCGGGGGCTGCAGGGCAGGGGTCAAGGGTTCAGTGGGGGCGGGAGGGGAGTGTCTGCAGGCTTGCAGGTCTCCCGGGTGGGGTCGGGGTTCCCTGCACTCATCCCC","alts":["A","C","G","T"],"phred":[[16.151,11.166,14.848,6.072,0.021,8.096,0.743,11.773,14.723,15.696,0.197,17.126,null,23.626,37.699,35.306,17.755,9.084,null,15.68,15.168,null,12.357,null,null,13.369,null,null,8.771,10.683,10.068,12.142,18.255,14.548,2.117,16.394,15.48,21.717,18.746,null,7.08,2.956,6.671,9.253,10.651,6.724,1.735,12.882,7.671,12.524,12.636,0.999,0.684,null,8.206,11.058,null,7.163,7.041,7.399,null,8.051,null,null,6.48,7.949,9.597,12.448,6.55,0.033,0.501,8.284,7.003,2.067,9.215,17.804,12.16,11.248,8.168,null,12.312,5.161,4.93,null,0.699,7.037,10.258,8.084,null,10.3,9.873,2.477,null,6.077,7.907,7.316,9.229,null,3.362,7.717,null,2.519,null,null,7.828,8.126,4.711,9.667,null,7.396,null,7.461,null,4.679,0.151,7.9,4.085,8.354,null,7.382,null,null,9.673,null,15.862,16.839,16.452,6.655,null,11.924,6.104,18.704,null,18.628,19.863,13.009,null,14.452,null,7.956,16.14,9.738,9.185,0.013,0.332,20.095,11.428,1.651,0.969,8.757,6.797,8.767,7.981,11.299,null,null,7.792,18.588,12.059,10.099,13.191,12.436,null,null,23.877,22.044,22.045,19.098,16.585,null,12.423,15.997,7.296,10.056,12.66,11.205,4.899,null,1.964,12.117,10.091,null,9.859,null,9.686,8.043,0.594,null,13.684,12.024,6.16,15.066,11.58,6.022,6.08,null,10.183,9.916,12.476,null,14.576,11.906,null,15.065,8.522,null,31.559,22.372,19.071,null,33.763,29.242,25.725,19.477,16.176,13.936,16.486,23.972,6.526,3.126,11.596,7.892,null,20.579,5.303,21.388,11.018,15.832,10.296,null,null,9.594,8.755,null,18.586,9.189,10.458,null,12.465,9.697,7.155,11.762,9.836,2.997,11.749,8.695,null,0.15,4.498,9.484,15.038,21.193,25.16,null,25.014,23.462,25.42,null,23.226,23.631,17.513,14.746,7.114,10.412,13.193,null,17.166,14.981,15.291,null,22.84,22.577,23.56,21.082,18.845,12.642,20.148,22.009,16.716,20.074,6.712,10.227,6.47,13.174,null,16.084,16.521,18.06,10.082,23.113,null,24.013,null,null,23.633,16.604,18.476,18.544,null,5.926,15.063,14.385,12.511,3.66,12.356,18.277,16.207,11.103,13.83,7.96,17.717,15.761,1.818,1.431,17.541,7.979,17.604,17.0,14.824,15.463,null,19.776,12.282,16.36,16.558,15.85,9.633,13.789,8.987,14.839,13.641,14.972,null,null,18.458,21.795,24.163,22.024,22.457,null,null,19.77,6.676,6.0,null,null,20.755,null,25.174,18.285,20.888,24.641,null,null,22.864,24.879,null,21.888,24.317,null,20.201,14.295,7.238,6.486,11.466,17.568,16.576,19.347,15.967,20.564,0.177,13.249,16.591,14.469,20.027,17.948,1.919,7.046,19.61,17.417,23.335,null,null,null,12.19,null,15.521,null,16.207,14.416,19.77,23.435,18.345,22.812,null,null,null,23.734,null,21.421,18.481,null,null,12.671,18.077,9.667,10.157,5.242,7.667,19.722,21.87,22.464,19.11,20.587,15.482,15.072,18.737,null,11.121,11.309,10.529,18.342,null,17.942,15.077,20.907,9.07,17.031,22.825,null,null,20.639,17.185,16.137,13.661,17.098,12.612,null,15.312,5.432,3.152,10.675,13.934,12.854,15.289,4.071,6.49,8.397,8.675,null,7.497,7.862,11.325,11.932,null,8.57,5.824,8.471,8.536,7.012,3.13,5.016,6.987,null,14.023,4.911,5.391,0.802,1.717,2.118,2.763,null,11.367,15.307,14.01,12.109,2.324,5.479,5.508,0.189,10.174,7.22,8.099,7.669,0.152,0.701,6.333,3.343,5.708,0.072,4.711,8.771,9.788,9.349,5.602,4.757,13.125,10.434,2.838,0.308,12.421,5.713,null,3.849,3.654,12.267,null,0.305,9.667,12.822,12.058,6.795],[15.588,12.346,14.375,null,null,13.813,0.498,12.79,14.714,15.822,0.263,16.978,14.717,null,null,34.696,27.086,8.213,16.125,15.342,16.679,16.33,21.461,14.975,17.636,20.603,18.929,9.07,9.52,9.802,7.11,null,null,12.976,6.935,16.509,null,22.436,17.968,17.075,14.137,1.47,8.039,10.306,9.802,6.249,1.756,6.13,null,null,5.836,4.242,null,0.143,10.139,null,2.009,6.426,12.559,null,6.653,19.772,7.67,9.427,6.864,null,null,null,null,0.015,0.915,7.385,null,5.326,null,null,null,null,null,6.693,null,8.99,null,0.362,19.146,6.95,2.453,null,9.782,16.517,null,null,2.715,8.259,17.009,7.961,10.151,2.522,5.36,8.993,3.874,3.259,5.845,2.38,9.938,18.178,0.652,null,0.336,null,10.032,11.516,6.226,21.194,null,9.645,6.032,7.805,4.709,9.16,16.288,10.027,12.429,14.787,null,null,17.476,null,0.775,24.29,12.245,15.79,18.11,null,null,null,7.601,22.209,6.781,8.217,12.002,null,null,null,4.975,13.485,null,null,2.575,8.895,9.278,10.445,10.096,null,6.058,8.749,8.802,9.402,null,null,22.105,12.786,19.986,19.277,null,null,22.435,15.936,16.292,7.735,22.925,null,2.263,10.499,17.314,11.298,9.032,6.471,9.493,null,null,6.049,8.777,12.695,24.203,8.977,12.523,13.63,null,null,6.421,15.941,12.643,4.327,null,7.146,10.587,10.012,null,8.835,17.402,null,0.008,15.504,14.545,20.021,null,18.65,null,32.968,null,null,24.462,null,null,16.035,9.389,null,9.473,null,9.998,null,3.556,13.102,7.267,null,15.7,null,15.356,14.326,7.264,12.768,null,8.45,10.744,null,null,0.196,14.96,null,5.813,null,9.188,5.538,10.45,null,2.175,0.401,8.842,13.319,null,null,25.073,22.929,24.675,26.15,26.852,24.102,25.303,26.953,18.692,null,5.68,9.344,null,8.057,17.2,null,null,15.749,21.99,22.911,23.144,20.652,null,10.102,20.804,23.125,16.959,null,3.197,9.101,7.446,17.853,19.913,17.049,18.714,null,15.11,22.899,23.748,22.994,22.682,23.188,24.181,null,null,null,21.632,17.874,null,null,null,null,18.29,23.603,null,null,null,8.583,16.573,10.681,4.304,6.9,null,3.071,18.066,null,20.376,null,13.779,null,13.595,16.602,17.943,13.844,null,null,9.822,15.222,12.608,null,4.032,20.124,17.888,20.887,23.663,22.544,21.818,21.417,18.954,null,7.66,4.158,10.536,16.556,20.325,18.552,25.419,20.991,22.584,null,24.233,23.736,21.582,25.543,20.555,22.9,null,22.861,20.384,null,3.679,null,11.73,19.067,13.269,null,null,null,0.119,13.528,16.519,14.994,19.961,null,1.246,4.961,18.675,17.938,null,21.666,23.13,22.789,1.989,21.743,14.608,20.775,18.634,15.618,20.033,22.627,17.788,null,21.482,22.675,22.633,null,20.832,20.276,null,19.624,14.058,13.208,null,9.761,9.27,null,13.91,20.934,22.876,22.328,19.769,null,15.038,14.984,null,7.522,11.773,11.774,10.825,null,13.335,16.315,16.958,21.713,12.495,16.501,null,21.006,16.915,18.801,16.972,16.379,14.583,17.396,null,8.991,14.58,6.45,6.598,11.688,14.435,13.058,15.347,null,6.479,9.043,6.408,3.704,6.523,8.432,11.346,13.623,5.883,8.466,4.734,8.922,8.365,null,3.441,3.897,null,3.773,14.433,4.404,null,0.369,1.822,1.824,null,7.099,11.71,15.587,15.239,null,2.349,null,null,null,6.704,7.154,7.322,7.392,0.22,2.024,7.133,5.242,7.968,null,2.025,12.31,9.653,10.328,7.334,5.606,null,null,null,0.219,11.805,null,0.318,null,5.715,null,10.014,3.864,null,null,null,null],[null,null,null,7.473,0.012,null,0.56,null,null,null,null,null,14.596,23.457,37.138,33.416,null,null,13.866,null,null,12.59,null,12.479,21.996,null,18.008,15.108,null,null,null,11.483,17.103,11.347,null,null,16.981,23.07,null,14.595,null,2.089,null,null,null,null,2.121,null,7.311,12.74,9.127,5.391,0.404,0.121,null,11.024,3.27,7.37,null,5.861,8.635,null,6.721,18.834,null,8.6,11.997,7.92,4.414,null,0.586,null,7.652,3.355,8.745,9.829,13.419,11.302,7.914,0.297,9.95,9.033,3.773,0.317,1.414,6.861,null,7.788,8.962,null,9.733,3.145,2.762,null,null,7.107,null,2.416,null,null,3.745,null,5.25,4.247,null,null,null,9.342,0.377,5.179,0.43,null,6.773,null,0.254,null,null,null,1.084,null,8.788,3.969,null,13.805,16.043,17.721,16.039,9.429,1.548,null,null,18.444,17.112,18.293,21.323,17.437,8.691,null,4.378,null,null,7.554,13.948,0.023,null,null,7.75,3.134,3.167,null,null,null,null,10.116,19.295,11.281,null,null,4.05,3.183,13.056,null,7.933,21.793,23.048,22.277,21.297,14.339,null,11.979,null,15.325,9.503,null,null,null,null,12.767,null,9.873,8.7,10.247,null,10.857,null,9.326,null,9.9,12.02,8.326,null,null,null,null,8.752,8.498,null,null,12.607,4.319,null,11.11,0.004,null,null,16.443,29.214,null,22.719,31.858,35.174,32.576,24.826,21.622,14.493,10.291,7.779,9.232,7.827,11.273,null,1.68,0.292,null,6.325,9.485,15.512,11.126,16.069,14.529,8.179,null,10.827,8.838,null,8.247,9.465,0.023,null,11.978,5.696,20.031,7.763,6.862,null,6.452,4.273,null,null,null,18.706,20.249,25.076,23.815,25.858,25.961,28.02,24.724,24.734,null,16.446,17.142,8.331,null,11.622,8.998,null,15.045,18.139,15.497,null,null,null,23.535,24.12,7.946,null,null,null,20.475,20.507,null,null,null,21.204,null,null,17.042,18.16,null,24.094,23.923,23.14,22.122,null,17.144,20.33,20.471,7.246,null,13.067,13.314,13.472,11.155,null,null,15.332,12.905,7.144,7.084,null,13.18,3.358,null,13.884,12.614,null,21.236,14.916,17.504,11.727,22.764,11.799,null,null,15.891,10.001,15.425,10.36,null,null,18.064,2.277,18.09,19.844,null,20.591,null,null,19.293,17.614,19.368,7.747,3.774,9.399,15.92,null,16.587,null,19.034,21.716,24.808,23.869,22.885,null,null,15.264,20.95,24.615,20.492,null,14.771,6.78,8.351,9.436,null,11.722,17.895,16.846,20.196,0.928,null,null,null,null,20.035,16.426,null,null,null,23.596,22.414,22.434,22.997,10.259,22.048,null,22.067,null,16.775,null,null,null,22.756,21.299,21.773,22.349,23.636,22.098,null,22.224,13.705,13.279,null,17.296,11.63,null,3.785,null,null,null,null,null,22.288,18.171,null,18.605,5.211,null,null,null,19.359,14.151,null,null,null,null,16.432,22.485,20.293,17.5